[
  {
    "code": "Public Domain",
    "name": "Public Domain / CC0 1.0 Universal",
    "url": "https://creativecommons.org/publicdomain/zero/1.0/",
    "isPublicDomain": true,
    "isOpenAccess": true,
    "spdxId": "CC0-1.0"
  },
  {
    "code": "CC BY 4.0",
    "name": "Creative Commons Attribution 4.0 International",
    "url": "https://creativecommons.org/licenses/by/4.0/",
    "isPublicDomain": false,
    "isOpenAccess": true,
    "spdxId": "CC-BY-4.0"
  },
  {
    "code": "CC BY-SA 4.0",
    "name": "Creative Commons Attribution-ShareAlike 4.0 International",
    "url": "https://creativecommons.org/licenses/by-sa/4.0/",
    "isPublicDomain": false,
    "isOpenAccess": true,
    "spdxId": "CC-BY-SA-4.0"
  },
  {
    "code": "MIT",
    "name": "MIT License",
    "url": "https://opensource.org/licenses/MIT",
    "isPublicDomain": false,
    "isOpenAccess": true,
    "spdxId": "MIT"
  }
]
